[
  {
    "id": "opp_01",
    "title": "منحة الحكومة التركية 2026",
    "title_en": "Turkish Government Scholarship",
    "organization": "الحكومة التركية",
    "type": "scholarship",
    "study_levels": [
      "bachelor",
      "master",
      "phd"
    ],
    "country": "تركيا",
    "funding_type": "fully_funded",
    "deadline": "2026-02-20",
    "yemeni_eligibility": "eligible",
    "summary": "منحة ممولة بالكامل للبكالوريوس والماجستير والدكتوراه، تشمل الدراسة والسكن وراتباً شهرياً.",
    "description": "تقدم الحكومة التركية منحاً لدراسة البكالوريوس والماجستير والدكتوراه في الجامعات الحكومية التركية المشاركة، ضمن تخصصات علمية وهندسية وصحية وإنسانية متعددة. تشمل المنحة سنة تحضيرية لتعلم اللغة.",
    "eligibility_criteria": [
      "الحد الأدنى للمعدل: 70% للبكالوريوس، و75% للماجستير والدكتوراه، و90% للطب وطب الأسنان والصيدلة.",
      "العمر: أقل من 21 سنة للبكالوريوس، وأقل من 30 سنة للماجستير، وأقل من 35 سنة للدكتوراه.",
      "لا تشترط شهادة إجادة الإنجليزية أو التركية وفق النص.",
      "المستندات المشتركة: صورة شخصية بخلفية بيضاء، وهوية وطنية أو جواز سفر ساري المفعول، وخطاب تحفيزي.",
      "مستندات البكالوريوس: شهادة الثانوية وكشف الدرجات، والشهادات التطوعية أو التدريبية التي حصل عليها المتقدم.",
      "مستندات الماجستير: شهادة الثانوية، وشهادة البكالوريوس وكشف درجاته، وخطاب توصية، وخطة بحث.",
      "مستندات الدكتوراه: شهادة الثانوية، وشهادتا البكالوريوس والماجستير وكشوف درجاتهما، وخطابا توصية، ورسالة الماجستير إن وجدت.",
      "يمكن للطلاب المتوقع تخرجهم تقديم كشوف الدرجات السابقة وإثبات القيد في السنة النهائية بدلاً من شهادة التخرج غير المتاحة."
    ],
    "benefits": [
      "تغطية الرسوم الدراسية بالكامل.",
      "تغطية السفر ذهاباً وإياباً.",
      "راتب شهري وسكن مجاني.",
      "سنة تحضيرية مجانية لتعلم اللغة.",
      "تأمين صحي."
    ],
    "source_url": "https://www.turkiyeburslari.gov.tr/",
    "verified_at": "2026-10-21"
  },
  {
    "id": "opp_02",
    "title": "منحة الحكومة الكورية GKS 2026",
    "title_en": "Global Korea Scholarship – GKS",
    "organization": "الحكومة الكورية",
    "type": "scholarship",
    "study_levels": [
      "bachelor",
      "master",
      "phd"
    ],
    "country": "كوريا الجنوبية",
    "funding_type": "fully_funded",
    "deadline": null,
    "yemeni_eligibility": "eligible",
    "summary": "منحة حكومية ممولة للدراسة في كوريا الجنوبية، تشمل الرسوم والسفر وراتباً شهرياً وسنة لتعلم الكورية.",
    "description": "برنامج لدراسة البكالوريوس والماجستير والدكتوراه في الجامعات الكورية المشاركة، عبر مسار السفارة أو الجامعة. يذكر الملف نوفمبر 2026 للبكالوريوس دون يوم نهائي محدد، بينما تتعارض سنة تقديم الدراسات العليا بين 2027 و2028؛ وتُراجع المواعيد لدى السفارة أو الجامعة.",
    "eligibility_criteria": [
      "العمر لا يزيد عن 25 سنة للبكالوريوس، أو 40 سنة للماجستير والدكتوراه.",
      "التقديم عبر مسار واحد فقط: السفارة مع إمكانية اختيار 3 جامعات، أو جامعة واحدة عبر مسار الجامعة.",
      "تعبئة طلب المنحة وتقديم جميع المستندات باللغة الإنجليزية؛ لا تقبل الملفات غير المكتملة أو المستندات المضافة بعد الموعد النهائي.",
      "المستندات المطلوبة المذكورة: خطاب توصية واحد، وإثبات جنسية المتقدم والوالدين، وإثبات صلة القرابة.",
      "المستندات الدراسية الواردة للبكالوريوس: شهادة الثانوية أو شهادة توقع التخرج، وكشف درجات الثانوية. مستندات الدراسات العليا غير مفصلة في النص.",
      "مستندات اختيارية: شهادة الدبلوم المتوسط وكشف درجاته، ونتائج TOPIK أو اختبار الإنجليزية، ونسخة جواز السفر، ووثائق الحالات الخاصة المذكورة في الطلب.",
      "يمكن إرفاق الجوائز والشهادات الداعمة بحد أقصى 5 وثائق."
    ],
    "benefits": [
      "تغطية الرسوم الدراسية بالكامل.",
      "تغطية السفر ذهاباً وإياباً.",
      "راتب شهري وسكن مجاني بحسب النص.",
      "تأمين صحي.",
      "سنة تحضيرية لتعلم اللغة الكورية."
    ],
    "source_url": "https://www.studyinkorea.go.kr/ko/receipt/OnlineReceipt11.do",
    "verified_at": "2026-10-21"
  },
  {
    "id": "opp_03",
    "title": "منحة أوبن دورز 2027",
    "title_en": "Open Doors Olympiad Scholarship",
    "organization": "وزارة التعليم العالي الروسية",
    "type": "scholarship",
    "study_levels": [
      "bachelor",
      "master",
      "phd"
    ],
    "country": "روسيا",
    "funding_type": "fully_funded",
    "deadline": "2026-11-01",
    "yemeni_eligibility": "eligible",
    "summary": "منحة للدراسة في روسيا بإعفاء كامل من الرسوم وراتب شهري، مع مسارات بالإنجليزية أو الروسية.",
    "description": "تتيح منحة أوبن دورز دراسة البكالوريوس والماجستير والدكتوراه في الجامعات الروسية المشاركة، عبر تقييم ملف الإنجازات واختبارات المسابقة. تتوفر الدراسة بالإنجليزية أو الروسية، مع إمكانية طلب مزايا إضافية مشروطة عند اختيار الروسية وبعد السنة التحضيرية.",
    "eligibility_criteria": [
      "البكالوريوس: العمر من 16 إلى 23 سنة، مع شهادة الثانوية أو إثبات الدراسة في السنة النهائية.",
      "الماجستير: العمر من 20 إلى 33 سنة، مع شهادة البكالوريوس أو إثبات الدراسة في السنة النهائية.",
      "الدكتوراه: العمر من 22 إلى 35 سنة، مع شهادة الماجستير أو Specialist أو إثبات قرب الحصول عليها.",
      "لا يحدد النص حداً أدنى للمعدل.",
      "المستندات الأساسية: نسخة واضحة من جواز السفر، وإثبات المؤهل الدراسي وكشف الدرجات، وخطاب تحفيزي.",
      "استكمال ملف الإنجازات واجتياز الاختبار التمهيدي، مع كتابة البيانات بالإنجليزية أو الروسية وترجمة المستندات الصادرة بلغات أخرى.",
      "يسمح بحساب واحد ومشاركة واحدة في دورة المنحة، مع مطابقة الاسم لبيانات جواز السفر.",
      "يمكن إضافة مستندات داعمة مرتبطة بالتخصص، مثل شهادات الدورات واللغة والجوائز والأبحاث والخبرة والمشروعات."
    ],
    "benefits": [
      "إعفاء كامل من الرسوم الدراسية.",
      "راتب شهري تقريبي: 3500–5000 روبل للبكالوريوس، و5000–7000 روبل للماجستير، ونحو 14500 روبل للدكتوراه؛ يختلف حسب الجامعة والمرحلة.",
      "إمكانية الدراسة بالإنجليزية دون شهادة إجادة اللغة وفق النص.",
      "سنة تحضيرية لتعلم الروسية عند اختيار الدراسة بها.",
      "إمكانية طلب دعم إضافي عند اختيار الروسية وبعد السنة التحضيرية: راتب يصل إلى 27093 روبل، وتغطية السفر والتأمين الصحي وتعويض السكن وفق الضوابط."
    ],
    "source_url": "https://od.globaluni.ru/",
    "verified_at": "2026-10-21"
  },
  {
    "id": "opp_04",
    "title": "منحة جامعة الملك عبدالله للعلوم والتقنية 2027",
    "title_en": "King Abdullah University Scholarship",
    "organization": "جامعة الملك عبدالله للعلوم والتقنية",
    "type": "scholarship",
    "study_levels": [
      "master",
      "phd"
    ],
    "country": "المملكة العربية السعودية",
    "funding_type": "fully_funded",
    "deadline": null,
    "yemeni_eligibility": "eligible",
    "summary": "منحة ممولة بالكامل للماجستير والدكتوراه في كاوست، تشمل الرسوم والسكن وراتباً شهرياً.",
    "description": "تقدم جامعة الملك عبدالله للعلوم والتقنية منحاً للماجستير والدكتوراه في تخصصات العلوم والهندسة والتقنية. يذكر الملف أن آخر موعد للتقديم منتصف يناير 2027 دون تحديد اليوم.",
    "eligibility_criteria": [
      "معدل لا يقل عن 3.0 من 4.",
      "العمر لا يزيد عن 30 سنة للماجستير أو 35 سنة للدكتوراه.",
      "تعبئة طلب التقديم باللغة الإنجليزية.",
      "المستندات المطلوبة: جواز سفر ساري المفعول، وشهادة آخر مؤهل دراسي وكشف درجاته، وسيرة ذاتية، وخطاب تحفيزي.",
      "تقديم 3 خطابات توصية وشهادة إجادة الإنجليزية TOEFL أو IELTS.",
      "إرفاق الأبحاث والمنشورات والخبرة البحثية إن وجدت."
    ],
    "benefits": [
      "تغطية الرسوم الدراسية بالكامل.",
      "تغطية السفر ذهاباً وإياباً وتكاليف التأشيرة.",
      "راتب شهري للماجستير بقيمة 1667 دولاراً.",
      "راتب شهري للدكتوراه يتراوح بين 2083 و2500 دولار.",
      "سكن مجاني للأعزب أو المتزوج.",
      "تأمين صحي."
    ],
    "source_url": "https://www.kaust.edu.sa/en/study/applying-to-kaust",
    "verified_at": "2026-10-21"
  },
  {
    "id": "opp_05",
    "title": "منحة تشيفينينغ 2026",
    "title_en": "Chevening Scholarship",
    "organization": "مؤسسة تشيفينينغ",
    "type": "scholarship",
    "study_levels": [
      "master"
    ],
    "country": "المملكة المتحدة",
    "funding_type": "fully_funded",
    "deadline": "2026-10-06",
    "yemeni_eligibility": "eligible",
    "summary": "منحة ممولة بالكامل لماجستير مدته سنة في بريطانيا، تشمل الدراسة والسفر وبدل المعيشة.",
    "description": "تتيح منحة تشيفينينغ دراسة الماجستير لمدة سنة واحدة في الجامعات البريطانية المشاركة، مع أنشطة مهنية وقيادية. تبدأ الدراسة في سبتمبر أو أكتوبر 2027 وفق الجدول الوارد. لا يفصل النص شروط الأهلية العامة.",
    "eligibility_criteria": [
      "تعبئة طلب التقديم باللغة الإنجليزية وكتابة جميع المقالات المطلوبة داخله.",
      "تقديم نسخة من جواز السفر أو الهوية الشخصية؛ يصبح جواز السفر مطلوباً عند القبول.",
      "تقديم شهادة التخرج الجامعية وكشف الدرجات. ويذكر النص إمكانية تقديم كشوف الدرجات المتاحة لطلاب السنة النهائية.",
      "تقديم بيانات شخصين لخطابات التوصية.",
      "عند النجاح في المقابلة، تقديم قبول جامعي غير مشروط واحد على الأقل بحلول 8 يوليو 2027، الساعة 17:00 بتوقيت الصيف البريطاني."
    ],
    "benefits": [
      "تغطية الرسوم الدراسية.",
      "تغطية السفر ذهاباً وإياباً.",
      "تغطية رسوم طلب التأشيرة البريطانية لمرة واحدة.",
      "راتب شهري لتغطية السكن والمعيشة والمصاريف الأساسية.",
      "بدل سفر لحضور فعاليات تشيفينينغ في لندن وفق شروط المنحة.",
      "المشاركة المجانية في فعاليات وورش وأنشطة مهنية وقيادية."
    ],
    "source_url": "https://www.chevening.org/scholarships/",
    "verified_at": "2026-10-21"
  },
  {
    "id": "opp_06",
    "title": "منحة الحكومة السعودية 2026 — ادرس في السعودية",
    "organization": "الحكومة السعودية",
    "type": "scholarship",
    "study_levels": [
      "bachelor",
      "master",
      "phd"
    ],
    "country": "المملكة العربية السعودية",
    "funding_type": "fully_funded",
    "deadline": "2026-05-21",
    "yemeni_eligibility": "eligible",
    "summary": "منحة للبكالوريوس والماجستير والدكتوراه في السعودية، تشمل الدراسة والسكن والسفر وراتباً شهرياً.",
    "description": "تقدم الحكومة السعودية منحاً للدراسة في الجامعات الحكومية المشاركة عبر منصة ادرس في السعودية، لدرجات البكالوريوس والماجستير والدكتوراه في برامج دراسية متعددة.",
    "eligibility_criteria": [
      "تعبئة طلب التقديم باللغة الإنجليزية.",
      "المستندات الإلزامية: جواز سفر ساري المفعول، وشهادة آخر مؤهل دراسي وكشف درجاته، وشهادة التخليص الأمني.",